{
  "$schema": "https://json-schema.org/draft-07/schema#",
  "title": "NetAI.TestGenerator Configuration",
  "type": "object",
  "required": [
    "version",
    "buildConfigurationFilter",
    "environment",
    "frameworks",
    "codeStyle",
    "generationBehavior",
    "aiConfiguration"
  ],
  "properties": {
    "$schema": {
      "type": "string"
    },
    "version": {
      "type": "string",
      "description": "The version of the configuration file.",
      "default": "1.1"
    },
    "buildConfigurationFilter": {
      "type": "string",
      "description": "Wann Testerstellung wird: 'all' oder kommagetrennt 'debug', 'release', 'publish'.",
      "default": "all"
    },
    "environment": {
      "type": "object",
      "required": [ "targetDotNetVersion", "testProjectName" ],
      "properties": {
        "targetDotNetVersion": {
          "type": "string",
          "enum": [ "net6.0", "net7.0", "net8.0", "net9.0", "net10.0" ],
          "description": "The target .NET version for generated code."
        },
        "testProjectName": {
          "type": "string",
          "description": "Test project name. Use {ProjectName} as a placeholder."
        }
      }
    },
    "frameworks": {
      "type": "object",
      "required": [ "testFramework", "mockingFramework", "useFluentAssertions", "useAutoFixture", "verbosePrompt" ],
      "properties": {
        "testFramework": {
          "type": "string",
          "enum": [ "xunit", "nunit", "mstest" ],
          "description": "The test framework to use."
        },
        "mockingFramework": {
          "type": "string",
          "enum": [ "moq", "nsubstitute", "fakeiteasy" ],
          "description": "The mocking framework to use."
        },
        "useFluentAssertions": {
          "type": "boolean",
          "description": "Whether to use FluentAssertions for assertions."
        },
        "useAutoFixture": {
          "type": "boolean",
          "description": "Whether to use AutoFixture to generate test data."
        },
        "verbosePrompt": {
          "type": "boolean",
          "default": true,
          "description": "Adds extended mode-specific explanations and examples to the AI prompt. Disable for small local models."
        }
      }
    },
    "codeStyle": {
      "type": "object",
      "required": [ "useFileScopedNamespace", "useAsyncSuffix", "maxLineLength" ],
      "properties": {
        "useFileScopedNamespace": {
          "type": "boolean",
          "description": "Use C# file-scoped namespaces instead of traditional blocks."
        },
        "useAsyncSuffix": {
          "type": "boolean",
          "description": "Require the 'Async' suffix for asynchronous methods."
        },
        "maxLineLength": {
          "type": "integer",
          "minimum": 60,
          "maximum": 200,
          "description": "Maximum line length before wrapping."
        }
      }
    },
    "generationBehavior": {
      "type": "object",
      "required": [ "testStrategy", "splitTestsByMethod", "maxTestsPerClass" ],
      "properties": {
        "testStrategy": {
          "type": "string",
          "enum": [ "Both", "Unit", "Integration" ],
          "description": "The test generation strategy."
        },
        "splitTestsByMethod": {
          "type": "boolean",
          "description": "Split tests into separate files based on the method."
        },
        "maxTestsPerClass": {
          "type": "integer",
          "minimum": 1,
          "description": "Maximum number of test methods per generated class."
        }
      }
    },

    "aiConfiguration": {
      "type": "object",
      "description": "Connection settings for the OpenAI-compatible LLM endpoint (local server or hosted API).",
      "additionalProperties": false,
      "required": [ "model", "temperature" ],
      "properties": {
        "baseUrl": {
          "type": "string",
          "format": "uri",
          "pattern": "/$",
          "default": "http://localhost:8081/",
          "description": "Absolute URL of the OpenAI-compatible endpoint. Must end with '/'. Defaults to a local server on port 8081. Examples: 'http://localhost:11434/' (Ollama), 'https://api.openai.com/'."
        },
        "model": {
          "type": "string",
          "default": "gpt-4o",
          "description": "The AI model to use (e.g. gpt-4o, claude-3-5-sonnet, llama3.1). Ignored by some local servers."
        },
        "temperature": {
          "type": "number",
          "minimum": 0.0,
          "maximum": 2.0,
          "default": 0.2,
          "description": "Model creativity (0.0 = deterministic; higher values = more creative)."
        },
        "timeoutMinutes": {
          "type": "integer",
          "minimum": 1,
          "default": 5,
          "description": "HTTP request timeout in minutes. Defaults to 5."
        },
        "systemPrompt": {
          "type": [ "string", "null" ],
          "description": "The system prompt that defines the AI role and rules. Optional."
        },
        "apiKey": {
          "type": [ "string", "null" ],
          "description": "Inline API key. Mutually exclusive with apiKeyEnvVar. Do not commit secrets to version control."
        },
        "apiKeyEnvVar": {
          "type": [ "string", "null" ],
          "description": "Name of the environment variable holding the API key. Mutually exclusive with apiKey. Recommended for cloud endpoints."
        }
      },
      "oneOf": [
        {
          "title": "Inline API key",
          "description": "API key provided directly in the file (e.g. for local servers requiring a token).",
          "properties": {
            "apiKey": {
              "type": "string",
              "minLength": 1
            }
          },
          "required": [ "apiKey" ],
          "not": { "required": [ "apiKeyEnvVar" ] }
        },
        {
          "title": "API key from environment variable",
          "description": "API key is read from the named environment variable (recommended for hosted APIs).",
          "properties": {
            "apiKeyEnvVar": {
              "type": "string",
              "minLength": 1
            }
          },
          "required": [ "apiKeyEnvVar" ],
          "not": { "required": [ "apiKey" ] }
        },
        {
          "title": "No API key",
          "description": "Anonymous access – omit both apiKey and apiKeyEnvVar (typical for local endpoints without authentication).",
          "not": {
            "anyOf": [
              { "required": [ "apiKey" ] },
              { "required": [ "apiKeyEnvVar" ] }
            ]
          }
        }
      ]
    }
  }
}