{
  "$schema": "aisettings-schema.json",
  "version": "1.1",
  "buildConfigurationFilter": "all",
  "environment": {
    "targetDotNetVersion": "net9.0",
    "testProjectName": "{ProjectName}.Tests"
  },
  "frameworks": {
    "testFramework": "xunit",
    "mockingFramework": "moq",
    "useFluentAssertions": true,
    "useAutoFixture": true,
    "verbosePrompt": true
  },
  "codeStyle": {
    "useFileScopedNamespace": true,
    "useAsyncSuffix": true,
    "maxLineLength": 120
  },
  "generationBehavior": {
    "testStrategy": "Both",
    "splitTestsByMethod": false,
    "maxTestsPerClass": 15
  },
  "aiConfiguration": {
    "baseUrl": "http://localhost:8081/",
    "model": "gpt-4o",
    "temperature": 0.2,
    "timeoutMinutes": 5,
    "systemPrompt": "You are an expert .NET developer. Write clean, maintainable code following Clean Code principles. Always use the Arrange-Act-Assert (AAA) pattern.",
    "apiKey": null,
    "apiKeyEnvVar": null
  }
}